,Most Representative Message Texts
0, Höcke Ein Mordkomplott gegen das Deutsche Volk Wahrheit ist unzerstörbar 
, Das Große Erwachen: „Immer mehr Deutsche glauben an geheime Mächte“ @LIONMediaNews
," Regieren ohne Ausbildung . Es grenzt schon an Ironie. Aber leider Realität in Deutschland. QUELLE Weitere spannende Beiträge : » Karl Lauterbach ""scholzt "" jetzt ! Tunnelblick in der Politik Begründung unerwünscht ————————————— PS: Sauber recherchierte und tagesaktuelle Informationen bekommst du auf unserem Telegram-Kanal: t.me/freiheitdergedanken klick Es gibt täglich Angriffe auf die Zensurfreiheit von Telegram, nur in unserem Newsletter können wir Dich dauerhaft informieren Also jetzt oder nie unseren Newsletter sichern: "
,"Dirk Müller: Konkrete Vorbereitungen - Krieg auf deutschem Boden - Es ist Zeit, Nein zu sagen! — Cashkurs.com 14:12"
, Die ganze Welt ist eine Bühne für die teuflischen Meister der Täuschung! FOLGT UNS: @QPLUSPLUSPLUS & @AUFSTIEG5DOFFIZIELL
,Nicht zu vergessen: Unter Zwang! 
,ALLE MACHT DEN NATO-PSYCHOPATHEN 
,Q the Plan to save the World! Die tiefe Spaltung wird überwunden! @Qanalwwg1wga
,Endlich eine Spur und klar: PUTIN WAR'S 
,"Landau: ""Tickende Zeitbombe nach Haftentlassung"" BQQMS "
1,Guten Morgen Zusammen mit Dankbarkeit wird aus dieser inneren Haltung dann мαηιƒєѕтαтιση Vertraue deiner Seele 
,Immer schön lächeln... ...dann bleibst du in deiner Mitte Mehr auf @maraswelt #Lustiges #Spirituelles
, Guten Morgen liebe Seelen habt einen schönen Tag mit viel Energie und liebevollen Momenten. @HerzengelKanal
,Gütige Seelen Mehr auf @maraswelt #Soulapp ️ Kaffeekässle
," Erinnere dich wieder an deine wahre Essenz Einen ganz zauberhaften, lebendigen Tag dir @weilwirgoettinnensind "
,Ein Tag voller Wunder Mehr auf @maraswelt #SprücheZitate ️ Kaffeekässle
, für den Alltag!
," @HerzengelKanal Ein gemütlicher Abend sei Dir gewünscht, wo sich Dein Herz öffnet und Deine Seele entspannt , so dass Du Deine Schöpferkraft fühlst für so allerhand ! Maria B."
,Herzmenschen verbindet Euch Mehr auf @maraswelt #SprücheZitate #HerzüberKopf ️ Kaffeekässle
, Guten Morgen liebe Seelen habt einen guten Start in den Tag mit viel Energie und liebevollen Gedanken sowie Sonnenschein im Herzen. @HerzengelKanal
2,Ganser enthüllt geheime Agenda | Wurden wir von den Medien belogen? @WERFREE we are peace 
,Dieter Broers: Kann die Katastrophe verhindert werden? Brutale Enthüllung @WERFREE we are peace 
,"@unzensiertinfoseite Jetzt hat das Böse der Achse eine Gegnerin gefunden. Es darf vorgestellt werden, AnaLena Baerbock Iran, Irak etc kommen vor lauter Lachen nicht in den Schlaf @unzensiert / @unzensiertV2"
,Das wird auch Zeit: Mehr: Neuer Ampel-Plan: Bis zu drei Jahre Knast für korrupte Abgeordnete! @WERFREE we are peace 
,"Benjamin Fulford: Wochenbericht vom 12.02.2024 Tod von König Charles, Biden-Implosion, Putin-Interview - alles deutet auf Regimewechsel im Westen hin Dieser Beitrag stellt ausschließlich die Meinung des Verfassers dar. Er muss nicht zwangsläufig die Sichtweise von Antiilluminaten TV wiedergeben. Artikel zum Video: Video auf Odysee: Nur Audio : #BenjaminFulford #Illuminati #Whistleblower Krisenvorsorge: Mehr kostenfreie Infos und Enthüllungen: Abonniere hier meinen Notfallkanal: Hier kannst du meine Arbeit unterstützen: KLICK DANKESCHÖN "
,"Benjamin Fulford: Wochenbericht vom 04.03.2024 Die Organisation ""Schwarze Sonne"" stellt ein Ultimatum: Ausrufung der Weltföderation oder Androhung des nuklearen Holocausts Dieser Beitrag stellt ausschließlich die Meinung des Verfassers dar. Er muss nicht zwangsläufig die Sichtweise von Antiilluminaten TV wiedergeben. Artikel zum Video: Video auf Odysee: Nur Audio : #BenjaminFulford #Illuminati #Whistleblower Krisenvorsorge: Mehr kostenfreie Infos und Enthüllungen: Abonniere hier meinen Notfallkanal: Hier kannst du meine Arbeit unterstützen: KLICK DANKESCHÖN "
,Giftige Wolke aus Polen über Deutschland? Keiner Spricht darüber? Wir schon! Quelle @WERFREE we are peace 
, BREAKING: Russland setzt den Präsidenten des Internationalen Strafgerichtshofs Hofmanski auf die Fahndungsliste Hier den vollständigen Artikel lesen: Krisenvorsorge: Mehr kostenfreie Infos und Enthüllungen: Abonniere hier meinen Notfallkanal: BÜCHER + KRISENVORSORGE + NATURPRODUKTE 
," ️ ️ ️ ️ ️ So sieht internationale Isolation aus. Und, Gott bewahre, zeigen Sie dieses Video bloß nicht dem deutschen Präsidenten. @WERFREE we are peace "
,"Fortsetzung ""DER STURM"" von Storm Rider: ""DIE STURMOPERATIONEN DER WELTALLIANZ"" ""Während Putin den ukrainischen Staat zu Fall bringt, werden CIA/MAJIC-Operationen, Geldwäscheoperationen, Biolabore und die Sicherung von Atomwaffen, die die NATO/CIA in der Ukraine lagert, aufgedeckt. Gleichzeitig hat TRUMP in den USA das korrupte Justizsystem entlarvt und einen militärischen PUTSCH aufgedeckt, der mit Ex-Präsidenten/dem derzeitigen Präsidenten Biden verbunden ist dieselben Präsidenten, die die Ukraine finanzieren und ihr Geld dorthin leiten. Die militärischen Operationen durch Ezra, Cheyenne Mnt. und White Hats innerhalb der 3-Buchstaben-Agenturen, die Operationen gegen Hillary Clinton durch Patrick Byrne Danger Close Operationen initiiert haben, mehrere verdeckte Operationen, die mit General Flynn verbunden sind, und andere wichtige Operationen, die mit den Operationen des United States Cyber Command's, Admiral Rogers und USSF Cheyenne Mountain zusammenhängen, fügen sich alle zu einer ENTHÜLLUNG EINER ÜBERNAHME-OPERATION DER VEREINIGTEN STAATEN, DURCH AUSLÄNDISCHE BERATER UND INNERE FEINDE MAJIC, CIA, DEEP STATE, 3 LETTER AGENCIES zusammen. DIE WICHTIGKEIT DER RUSSISCHEN HILFE ZUR ZERSTÖRUNG DER DEEP STATE-UKRAINE OPERATIONEN und der CIA-Geldwäscheoperationen MUHAMMAD BIN SALAM großer Freund von Trump beendet den CIA DEEP STATE FIAT U.S. DOLLAR, DER DIE WELTREGIERUNGEN KONTROLLIERT erst kürzlich ließen die Saudis den US-Dollar fallen. White Hats in Israel, bringen das falsche, zionistische, israelische Regime zu Fall eine massive Revolte und eine Revolution wird beginnen und die militärische Besetzung, die die israelischen Kräfte und Führer des Deep State verhaftet, ist geplant. Die europäische Revolution beginnt, da über 70% der Europäer die von der CIA eingesetzten GLOBALISTEN bei den aktuellen Wahlen ablehnen. Eine massive Entlarvung der PLANDEMIE, der Impfstoff-Todesfälle und der Entlarvung des VIRUS wird Europa treffen und Massenwut und Revolte werden die Straßen erreichen, da der Zusammenbruch des Finanzsystems mit voller Wucht eintreten wird, mit BLACKOUTS, CYBER ANGRIFFEN und FALSE FLAG ERREIGNISSEN. ABER ALLES WIRD AUFGEDECKT WERDEN. Trumps Wichtigkeit für die Operationen, die die CIA, die Fünf-Augen-Agenturen und den militärischen PUTSCH AUFDECKEN. Diese WELTSTURM-OPERATIONEN GESCHEHEN ALLE IN EINHEIT. Ich habe Ihnen schon vor Jahren gesagt, dass diese Ereignisse alle zu einer vorgetäuschten, geplanten nuklearen Konfrontation führen werden. JETZT STEHT RUSSLAND MIT ATOMSCHIFFEN UND U-BOOTEN VOR DEN KÜSTEN UND GRENZREGIONEN DER VEREINIGTEN STAATEN. Dieses Ereignis ist lebenswichtig, da DC, CIA, DOD, massive Fehler machen werden, die zur Enttarnung führen werden: OPERATIONEN DES DEEP STATE. Dieses Ereignis soll die Amerikaner und die schlafenden Schafe aufrütteln, damit sie aufwachen und sehen, dass ihre Führer korrupt sind und das korrupte, lügende System. Fake News dieses EREIGNIS geschieht, damit dies zu einer militärischen Intervention und zur Entlarvung der NATO, der CIA und der Anstiftung Russlands zum Krieg, im Jahr 2025 führen wird. DIE KOMMENDEN TRIBUNALE UND WELTGERICHTE SIND BEREITS IN DER NEBELWELT FÜR ANKLAGEN UND FRÜHE VERFAHREN. Dieses RUSSISCHE KRIEGSEREIGNIS wird zu einer Überholung der US-Militärverfahren Säuberung der Deep State Militärkommandos durch Trump führen. Wenn Trump in sein Amt zurückkehrt platziert!, wird er die WELT WIEDERVEREINIGEN! Was glaubt ihr, warum ich schon vor Jahren wusste, dass sich all diese Ereignisse entfalten würden und warum ich euch die ganze Zeit über geführt habe, liebe Patrioten Habt keine Angst vor den Ereignissen ES MUSSTE SO KOMMEN. Q MILITÄR IST DER EINZIGE WEG IHR SEHT EIN Ihr habt mehr als ihr wisst"" Link zum Beitrag @QSRdeutsch"
3,Remember Who You Are. #DarktoLight #WWG1WGA #thegreatawakening #Truth RealSGAnon
,Lin Wood on 9/11! @drue86
,"We are all with you now, Patriot. Thank you for holding the line of Truth. #WWG1WGA #GodWins #AndSoDoWe RealSGAnon"
,It is our turn now! @SeeBeyondTheVeil
,"""Our country is being destroyed by probably very sick, very evil people"" - President 45, IA Rally, 7/7/2023 RealSGAnon"
,Let's give Them Hell #JoeM @areyouawake1
, Wow. Watters and guest on Fox News literally talking about the “normies waking up” Incredible H/T @StormyPatriotJoe 
,This POS has gone to hell. Share Share Share! SHARE!! #MAGA #TRUMP2024 #WWG1WGA #NCSWICN #QANON #SAVETHECHILDREN #THEGREATAWAKENING JOIN: 
,Only the real conspiracy theorists will understand @cookingwithlov ‍ 
,"KEEP GOING, PATRIOTS! You can purchase a ticket for a stranger too!! Let’s hit that mark! "
4,"""Sind die bescheuert?"" – Putin über Kiewer Regierung"
, Und hier noch die Explosion in voller Länge. #Russland #Ukraine Abonniere @MilitaerNews Diskutiere im @MNChat
,+++ EILMELDUNG +++ RT-Chefin Simonjan: Deutsche Militärs planen Angriffe auf Krim-Brücke 
,"Kommentare aus dem ukrainischen Internet zum Terroranschlag: ""Warum gibt es so wenig solche Konzerte?"" ""Die russische Schweine sollen alle sterben"" ""Das ist ja geil!"" ""Meine Erektion ist groß!"" ""Oh mein Gott, wie schön das ist!"" ""Die Russen eliminieren sich selbst, wie toll!"" USW. Nichts neues. Alles, was wir von Banderiten seit 2014 hören..."
,"Ukrainische Elitekämpfer diskutieren in durchgesickerten Chats die Absetzung Zelenskys: „Lasst uns diese grüne Ratte vernichten! #Ukraine Zunächst möchte ich darauf hinweisen, dass diese Geschichte ausschließlich aus russischen Medien stammt. Wenn Sie also glauben, dass es sich um Propaganda handelt, sollten Sie diesen Artikel überspringen. Aber ich weiß, dass Leser in der Lage sind, Informationen aus einer Vielzahl von Quellen zu beziehen, einschließlich der westlichen MSM-Propagand.. "
," Das bittere Erwachen? `Das bittere Erwachen eines deutschen ""Journalisten"" aus der westlichen Herrenmenschen-Propaganda zur eigenen Überlegenheit auf allen Gebieten...` Keine Runde Mitleid für diesen Lügner und Propagandisten, der als mitleiderregender US-Knecht bei der US-Lügenkampagne teilnahm und teilnimmt. Russland hat doch schon längst verloren??!? Wie soll es auch kämpfen - zuerst sind die Raketen zur Neige gegangen und dann die russischen Panzer - das nur aufgrund der weit überlegenen westlichen Waffen wie den Shadow Storm Raketen und netürlich den Leopards und anderen Tierpanzern. Und als dann auch noch die Wasch- und Geschirrspülmaschinen ausgingen, war das minderwertige Russland völlig am Ende. Worüber beschwert er sich also oben genau? ☆ Folgt uns ☆ Russländer & Friends "
,Tolle Aktion auf der Demo gegen Rechts in München. Schon krass wie gehirngewaschen all die Hasser sind ———————————————————— Mehr gibt es hier im Kanal Politische Nachrichten Angriff auf ukrainische Soldaten mit Bomben von einer Drohne Das Schweigen der Manager. Warum die DAX-Vorstände nicht gegen die Ampel-Politik aufbegehren British Media and Propaganda
,Feurige Hölle für die ukrainischen Streitkräfte bei der Offensive der Russen in der Nähe von Belogorovka: „Solntsepok“ und „Grad“ brennen den Feind aus. Die Musik ist furchtbar... ———————————————————— Mehr gibt es hier im Kanal Politische Nachrichten FDP erhebt schwere Vorwürfe. So soll sich der Bund in der Rentenkasse bedienen Russen brennen Gräben mit Drohnen nieder WHO-Chef Tedros ist zuversichtlich über Pandemievereinbarung
,"+++ EILMELDUNG +++ Verätzungen, Übelkeit und Erbrechen – Ukraine setzt US-Chemiewaffen gegen russisches Militär ein "
," Keine tödlichen Waffen der NATO für Kiew und ein Geschenk der EU für Putin: Die Ereignisse des 29. November ➥ Hier den Artikel lesen Hier übersetze ich die Zusammenfassung der Ereignisse in und um die Ukraine des 29. November, wie sie in der russischen Nachrichtenagentur TASS veröffentlicht wurde. @AntiSpiegel • Thomas Röper"
5,Neujahrsansprache Wladimir Putin: Dirk Dietrich 
,Kanal Q-Faktor Germany News @QFaktorGermany
,Vladimir - 28.01.2024 t.me/QFaktorGermany
," #Klimahumor, Wissenswertes und News in der demokratischen Endzeit "
,Guten Tag Die Sonne bringt nicht nur Licht in die Welt Sondern auch in uns Kanal:NatürlichkeitErkennen
," ŢᗩŢS MEINE SEELE KRIEGT IHR NICHT - Alien's Best Friend - 08.06.2023 Wir können unseren Seelenplan nur erkennen, wenn wir uns von der Manipulation des Außen befreien und uns bewusst darüber werden, dass wir Schöpferwesen sind. Selbstbestimmung und Eigenverantwortung sind der Schlüssel. ☛ ᴅᴇɴᴋᴛ ɴᴀᴄʜ, ᴅᴇɴᴋᴛ ꜱᴇʟʙꜱᴛ Quelle: ☞ YOUTUBE ""Wir bedanken uns für eure Treue"" ŢᗩŢS~Team •~✿~•"
,Wittlich
,Wir haben es in die Deutschen Medien geschafft! #Budapest #Friedensmarsch 
,"Schau dir ""Deutsche Übersetzung: Putin Interview von Tucker Carlson"" auf YouTube an "
,Das Ende
